厦门固克涂料集团有限公司,7570
吉林省兰舍硅藻新材料有限公司,16449
广州市欧陆建材有限公司,18236
上海福精特金属装饰材料有限公司,35434
吉祥集团有限公司,18181
英特普莱特(中国)装饰材料有限公司,16621
老虎粉末涂料制造(太仓)有限公司,29042
沈阳远大铝业集团有限公司,6745
江苏兰陵化工集团有限公司,3429
山东东佳集团股份有限公司,38459
浙江爱尔菲集成家居有限公司,46544
福建万安实业集团有限公司,29043
成都建丰林业股份有限公司,16620
江河创建集团股份有限公司,18697
飞利浦(中国)投资有限公司,8
河南佰利联化学股份有限公司,38460
富思特新材料科技发展股份有限公司,20890
齐峰新材料股份有限公司,5217
吉林省绿森林环保科技有限公司,16450
中航三鑫股份有限公司,1912
江苏冠军涂料科技集团股份有限公司,6331
东莞梵尔赛灯饰有限公司,12046
湖南华天铝业有限公司,18194
广州市玻璃先生实业有限公司,18048
中山市文联灯饰有限公司,22921
广东蒙娜丽莎创意设计有限公司,36441
山东圣光化工集团有限公司,7597
贵州水晶有机化工(集团)有限公司,13808
北新集团建材股份有限公司,1779
上海骐明贸易有限公司,14190
江门市全富电器有限公司,17277
利亚德光电股份有限公司,17211
四川天府防火材料有限公司,7598
深圳市彩虹精细化工股份有限公司,2347
深圳市联建光电股份有限公司,12566
潍坊市宏源防水材料有限公司,14099
嘉兴市克兰斯电器有限公司,1183
深圳市锐拓显示技术有限公司,17212
珠海市晶艺玻璃工程有限公司,18698
铃鹿复合建材(上海)有限公司,36684
广西祥盛木业有限责任公司,24496
优时吉博罗石膏建材(上海)有限公司,18814
南京洛普股份有限公司,17213
浙江鼎美智装股份有限公司,1193
法狮龙建材科技有限公司,1164
广西丰林木业集团股份有限公司,12036
浙江盛龙装饰材料有限公司,16626
中山盛兴股份有限公司,18693
浙江巨奥铝业有限公司,14171
江门劳士国际电气有限公司,17126
南通吉祥实业有限公司,18191
河北恒源实业集团有限公司,16624
辽宁吕氏化工(集团)有限公司,4547
山东华美建材有限公司,17203
方大集团股份有限公司,18695
武汉拜尔木业有限公司,674
山东常青树胶业股份有限公司,13807
江苏格力斯特新材料有限公司,37196
凌云科技集团有限责任公司,18694
艾仕得涂料系统(上海)有限公司,29053
广东奥科特新材料科技股份有限公司,7418
洛斐尔建材(沈阳)集团有限公司,16046
肇庆欧迪斯实业有限公司,47399
中山市迈克化工有限公司,47404
惠东美新塑木型材制品有限公司,18643
东阿蓝天七色建材有限公司,7752
广州市标榜汽车用品实业有限公司,40536
徐州清大吉博力建材有限公司,17368
东莞华尔泰装饰材料有限公司,7659
深圳市博伦思品牌管理有限公司,16814
台山市大亨玻璃工艺有限公司,18051
湖南湘江涂料集团有限公司,2290
江西雅丽泰建材股份有限公司,3821
天津市鑫源森达新材料科技有限公司,26837
东莞市万江雅兰装饰实业有限公司,16817
佛山市皇磁陶瓷有限公司,29032
佛山市荣冠玻璃建材有限公司,17185
上海琉园水晶制品有限公司,8854
四会市伟祺玻璃建材有限公司,17190
福州筑尚环保科技有限公司,18169
上海佳鹭新型建材有限公司,16454
广州金穗华石膏制品有限公司,17197
广东介仁玻璃有限公司,18049
雅泰实业集团有限公司,18188
佛山市石湾裕龙陶瓷有限公司,17186
北京大津硅藻新材料股份有限公司,16448
广东家美陶瓷有限公司,16317
广东沙漠绿洲涂料有限公司,1170
哈尔滨市雅典娜石膏装饰制品有限公司,17201
福建省晋江协隆陶瓷有限公司,8652
阿特拉斯•科普柯(中国)投资有限公司,19198
博深工具股份有限公司,1397
乐普艺术陶瓷有限公司,28420
上海虎啸电动工具有限公司,1408
佛山市顺德区赛德装饰材料有限公司,17187
晋江腾达陶瓷有限公司,528
大连远东工具有限公司,6596
上海田岛工具有限公司,17670
欧姆龙自动化(中国)有限公司,16410
浙江三锋实业股份有限公司,29849
新嘉理(江苏)陶瓷有限公司,28422
常州新区金利宝塑料制品有限公司,26815
陕西秦力橡胶有限责任公司,13294
广州秀珀化工股份有限公司,1245
重庆亚华世家居室艺术有限公司,25222
东莞市三友联众电器有限公司,24350
亚地斯建材(上海)有限公司,28795
安泰科技股份有限公司,15803
苏州一光仪器有限公司,23977
万华生态板业股份有限公司,23355
山东拜尔建材有限公司,13308
广州金发绿可木塑科技有限公司,18642
广州戈兰迪新材料股份有限公司,16759
励精科技(上海)有限公司,36144
广州南方测绘科技股份有限公司,36150
成都磊富艺术石业有限公司,26844
佛山碧莎马赛克有限公司,17184
江苏飞达钻头股份有限公司,8563
上海工具厂有限公司,6598
河南黄河旋风股份有限公司,17401
广东奔朗新材料股份有限公司,17414
中国西电集团公司,7841
哈尔滨量具刃具集团有限责任公司,6600
黑旋风锯业股份有限公司,6590
盼盼安居门业有限责任公司,336
深圳市安泰信科技有限公司,16437
湖北金海达新型材料有限公司,29033
大全集团有限公司,7854
长沙新振升集团有限公司,37445
浙江菲尔特工贸有限公司,1955
许继集团有限公司,7330
方大控股有限公司,6568
广州黄花电子工具有限公司,18594
宜兴凯华陶瓷有限公司,28424
佛山市欧铂利复合材料有限公司,64366
佛山市荣高智能科技有限公司,35390
佛山市顺德区欧雅典建材制品有限公司,12894
南京志绿声学科技有限公司,36674
佛山郡豪智能门窗有限公司,58255
大力科技集团有限公司,2149
宝时得科技(中国)有限公司,11295
小米科技有限责任公司,12487
合正机械股份有限公司,19200
安德烈斯蒂尔动力工具(青岛)有限公司,24019
群升集团有限公司,1432
日立工机商业(中国)有限公司,1376
哈尔滨飞云实业有限公司,2134
亚萨合莱(中国)投资有限公司,26624
常州市莱赛激光工程有限公司,23983
深圳市森诺韦尔建材有限公司,20749
多玛门业控制科技(中国)有限公司,19819
茂硕电源科技股份有限公司,22103
盖泽工业(天津)有限公司,19820
大连舒心门业有限公司,1746
哈尔滨第一工具制造有限公司,9704
波士胶(上海)管理有限公司,13771
浙江欧雅纳特木业有限公司,1679
亚萨合莱天明(北京)门业有限公司,26625
华升富士达电梯有限公司,1654
浙江奥格尔心缘工贸有限公司,2100
中国电子科技集团公司,1497
上海绿娃科技有限公司,17173
惠州海格电气有限公司,16430
东莞市怡丰锁业有限公司,35799
浙江奥鹏工贸有限公司,1722
杭州众冉门窗有限公司,45807
浙江中马园林机器股份有限公司,24021
山西孟氏实业有限公司,2028
上海林得纳建筑装饰工程有限公司,17110
长沙富尔凯窗业有限公司,1739
江苏好太太家居建材有限公司,8842
芜湖海螺新材料有限公司,1769
立川窗饰工业(上海)有限公司,26627
广东耀东华家具板材有限公司,20168
山西广千木业有限公司,20927
浙江强力控股有限公司,46744
深圳拓奇智造家居新材料股份有限公司,24503
广东中迅新型材料有限公司,16750
浙江中财型材有限责任公司,2008
大连实德集团有限公司,1771
浙江宇森百联工具有限公司,24024
常熟开关制造有限公司,3948
清远大中塑胶制品有限公司,2113
湖南省金为新材料科技有限公司,17534
海蒂诗五金配件(上海)有限公司,14112
西安高科建材科技有限公司,14096
上海捷科工具有限公司,17665
东莞市美饰家窗帘制品有限公司,42797
浙江博大实业有限公司,1379
绍兴市天龙锡材有限公司,46745
天津开发区陆成工贸有限公司,46291
广州市诗尼曼家居有限公司,1054
中国建材集团有限公司,1261
自动门>>,60247
安徽海螺水泥股份有限公司,1258
中国建材股份有限公司,1779
霍尼韦尔安防(中国)有限公司,20107
中国宝武钢铁集团有限公司,1836
唐山冀东水泥股份有限公司,1259
河钢集团有限公司,11357
沙玻玻璃集团有限公司,14111
中国华润总公司,12271
上海艺极楼梯有限公司,1671
江苏沙钢集团有限公司,1841
威海中玻镀膜玻璃股份有限公司,1895
鞍山钢铁集团公司,1837
浙江希尔登楼梯有限公司,20173
金星铜集团有限公司,1975
株洲旗滨集团股份有限公司,22025
攀钢集团有限公司,15296
山东泰山钢铁集团有限公司,14630
北京美驰建筑材料有限责任公司,4032
安徽环瑞电热器材有限公司,24748
成都硅宝科技股份有限公司,15989
国泰消防科技股份有限公司,2144
高时(厦门)石业有限公司,1283
山东冠洲股份有限公司,29748
深圳康利石材有限公司,1290
上海邦尼金属制品有限公司,14053
威特龙消防安全集团股份公司,16937
江苏华通木业有限公司,1685
厦门万里石股份有限公司,1294
四川金广实业(集团)股份有限公司,37449
锋泾(中国)建材集团有限公司,48080
山东钢铁集团有限公司,22222
广东克劳迪卫浴科技股份有限公司,363
江苏皮尔萨管业股份有限公司,8297
纳博克自动门(北京)有限公司,60248
亨特道格拉斯窗饰产品(中国)有限公司,9668
天津军星管业集团有限公司,4964
北京凯必盛自动门技术有限公司,60250
临江市宝健木业有限责任公司,6832
上海康宇铜门设计工程有限公司,1947
江苏大明金属制品有限公司,37455
苏州九牧管业科技有限公司,12266
福建省鑫森炭业股份有限公司,16516
上海三菱电梯有限公司,1614
遂昌碧岩竹炭有限公司,20801
玻璃胶>>,16486
深圳市格瑞卫康环保科技有限公司,15644
天津钢管集团股份有限公司,2727
深圳科松电子技术有限公司,11425
中南钻石有限公司,17402
台州迪奥电器有限公司,916
天津友发钢管集团股份有限公司,3379
佛山市顺德区乐华陶瓷洁具有限公司,102
河南四方达超硬材料股份有限公司,17403
浙江卖炭翁生态开发有限公司,16512
深圳市特发信息股份有限公司,22096
浙江久立特材科技股份有限公司,2353
晶日金刚石工业有限公司,17404
上海兰舍空气技术有限公司,24036
江苏永鼎股份有限公司,8596
山东昌润钻石股份有限公司,17406
通力电梯有限公司,1647
浙江海亮股份有限公司,8920
日立(中国)有限公司,1376
福耀玻璃工业集团股份有限公司,1886
苏州自来水表业有限公司,7270
湖北凯乐科技股份有限公司,11922
万隆石业(福建)有限公司,14141
江苏玉龙钢管股份有限公司,17635
天津市利达钢管集团有限公司,5573
苏州中瑞嘉珩景观工程有限公司,38492
中山德立洁具有限公司,409
凯斯宝玛五金贸易(上海)有限公司,17871
华新水泥股份有限公司,11486
江苏爱舍墙纸有限公司,1126
广州市欧美斯家具有限公司,1069
绍兴艾是家居用品有限公司,39296
丰胜(广州)建材有限公司,38488
江西省央海实业有限公司,787
中国普天信息产业股份有限公司,13323
巩义市嵩山滤材有限公司,48992
番禺珠江钢管有限公司,3137
江西山友实业有限公司,773
Mr.Moriyama,182
武汉金牛经济发展有限公司,1362
郑州中原思蓝德高科股份有限公司,16488
福建宏发集团有限公司,1284
爱迪士(上海)室内空气技术有限公司,24039
广东壁尚墙布有限公司,63737
浙江永裕竹业股份有限公司,784
浙江红狮水泥股份有限公司,1269
江西康达竹制品集团有限公司,775
深圳市美之高实业发展有限公司,47103
嘉华金属(上海)有限公司,16568
宁波水表股份有限公司,7261
浙江大庄实业集团有限公司,772
三川智慧科技股份有限公司,7262
江苏上上电缆集团有限公司,1320
杭州壁虎墙布有限公司,39770
新天科技股份有限公司,7281
泉州佳乐电器有限公司,11455
河南永威安防股份有限公司,7512
合肥博凯厨饰有限公司,28683
许昌美特桥架股份有限公司,38883
月星集团有限公司,982
永康市三马工贸有限公司,1731
东莞长谷川金属制品有限公司,23036
奉化市南方机械制造有限公司,18967
华立科技股份有限公司,7266
武汉欧亚达家居集团有限公司,14184
浙江金华天开电子材料有限公司,17108
广东好太太科技集团有限公司,8072
重庆智能水表集团有限公司,7267
江苏向利防静电装饰材料股份有限公司,538
北京天山新材料技术有限公司,35745
江苏凯莱木业有限公司,687
佛山市金舵陶瓷有限公司,466
江苏盛港建设安装工程有限公司,7511
实用动力(中国)工业有限公司,19226
江西松涛竹业有限公司,782
上海派尔科化工材料股份有限公司,35596
南京消防器材股份有限公司,7411
河北友联机房设备厂,539
泰州海陵液压机械有限公司,18969
斯必克(中国)投资有限公司,19227
普若泰克科技发展(北京)有限公司,19230
张家港市玉龙科技板材有限公司,7509
首安工业消防有限公司,7412
广东嘉俊陶瓷有限公司,8907
上海鉴道实业有限公司,38889
深圳赫美集团股份有限公司,7318
通鼎互联信息股份有限公司,2948
摩米士科技(深圳)有限公司,6729
江苏好太太木业有限公司,64079
山东南山铝业股份有限公司,1801
上海舜诺机械有限公司,39891
宁波方力集团有限公司,23954
江苏通润机电集团有限公司,19249
上海宝山千斤顶总厂有限公司,18966
广东华昌铝厂有限公司,1810
福建省南平铝业股份有限公司,2940
杭州立昌工具有限公司,6578
湖北回天新材料股份有限公司,16954
福建省冠林科技有限公司,11459
广东柔乐电器有限公司,12608
江苏欧象万盛木业有限公司,677
江苏中诚建材集团有限公司,17880
杜邦中国集团有限公司,1190
辽宁大禹防水科技发展有限公司,13402
上海金涂装饰材料有限公司,28603
厦门宏发电声股份有限公司,8109
苏州金螳螂建筑装饰股份有限公司,7865
浙江顶善美集成吊顶有限公司,12432
上海翔实玻璃有限公司,18047
中山市振辉消防设备有限公司,7417
四国化研(上海)有限公司,20888
美巢集团股份公司,8663
北京德合家木业有限公司,613
徕卡测量系统(上海)有限公司,23976
浙江帝龙文化发展股份有限公司,16618
广东新风景陶瓷有限公司,21158
嘉兴星雅图集成家居有限公司,12893
广州和新实业有限公司,47400
青钢金属建材(上海)有限公司,18657
北京金隅集团有限责任公司,18945
西卡(中国)有限公司,14100
广东宏宇集团有限公司,462
武汉美瑞爱家环保科技有限公司,27389
天水风动机械股份有限公司,7872
中核华原(上海)钛白有限公司,38524
宁波燎原灯具有限公司,22170
福建福日电子股份有限公司,17217
唐山德生防水股份有限公司,18063
武汉双虎涂料有限公司,9326
北京恒通创新赛木科技股份有限公司,26524
江阴利泰装饰材料有限公司,7520
开平市玫瑰艺术马赛克有限公司,17188
深圳元亨液晶显示有限公司,16068
广州保赐利化工有限公司,5969
山东德惠来装饰瓷板有限公司,29031
河北小蜜蜂工具集团有限公司,15761
浙江高牌木业有限公司,11116
山西三维集团股份有限公司,13707
杭州巨星科技股份有限公司,17660
北京博飞仪器有限责任公司,36146
中山市卓高建材有限公司,59939
南京圣沁源贸易有限公司,17438
潍坊优丽雅装饰软包制品有限公司,17020
佛山市三水罗马利奥陶瓷有限公司,523
吉林森林工业股份有限公司,12485
株洲硬质合金集团有限公司,843
广州市建骏装饰材料有限公司,26949
上海捷步实业有限公司,1675
江苏金秋竹集团有限公司,1743
深圳达实智能股份有限公司,1450
湖北福汉木业(集团)发展有限责任公司,8640
上海宝产三和门业有限公司,1747
威可楷(中国)投资有限公司,25179
河北星烁锯业股份有限公司,6589
雷帝(中国)建筑材料有限公司,35593
泉州银盾斯金金属制品有限公司,35419
施耐德电气(中国)有限公司,7450
广东福美软瓷有限公司,28426
杭州华丰巨箭工具有限公司,47996
浙江天正电气股份有限公司,1635
徐州市信步装饰科技有限公司,1698
深圳市好百年家居连锁股份有限公司,1471
诺托·弗朗克建筑五金(北京)有限公司,19803
东芝(中国)有限公司,7046
山西今朝木业有限公司,64630
杭州普吉尼家居用品有限公司,1037
东莞市东成石材有限公司,1287
佛山市立家卫浴有限公司,21009
日照海恩锯业有限公司,35658
江苏常宝钢管股份有限公司,11653
溪石集团发展有限公司,1279
江苏森豪仕软木有限公司,614
同方锐安科技有限公司,17747
中国机械工业集团有限公司,2239
台湾玻璃工业股份有限公司,1883
杭州友邦焊锡材料有限公司,46741
连云港美步家居有限公司,1669
航天晨光股份有限公司,21946
天广中茂股份有限公司,7410
大唐电信科技产业控股有限公司,13321
安徽安泽电工有限公司,7629
上海恒康地采暖工程有限公司,14455
安徽龙格装饰材料有限公司,55975
中国联合水泥集团有限公司,11516
华鹏集团有限公司,7920
金德管业集团有限公司,1349
宁波东海集团有限公司,7264
索尼(中国)有限公司,2
杭州天蓝蓝实业有限公司,11741
佛山市理想卫浴有限公司,410
上海青木装潢制品有限公司,46293
超杰集团有限公司,25454
欧宝电气(深圳)有限公司,38881
上海富美家装饰材料有限公司,7507
张家港市惠龙科技环保建材有限公司,7510
北京金色润宝科贸有限公司,17748
台泥(英德)水泥有限公司,29569
京华创新集团有限公司,36374
杭州永欣纺织有限公司,35815
广东高微晶科技有限公司,25942
上海耀皮玻璃集团股份有限公司,1897
富乐(广州)粘合剂有限公司,35744
深圳市景江化工有限公司,28797
佛山红狮陶瓷有限公司,28421
保丽(香港)有限公司,583
大力控股有限公司,6569
三星电子株式会社,3
浙江东亚工具有限公司,15389
杭州毕仕大纺织有限公司,58116
合和胶板(东莞)有限公司,26925
广东伟业铝厂集团有限公司,1819
江西腾达竹木业有限公司,779
上海金力泰化工股份有限公司,14144
西安青松科技股份有限公司,17215
西安静林软木地板有限公司,605
山高刀具(上海)有限公司,841
安徽安纳达钛业股份有限公司,38465
乐金华奥斯(天津)有限公司,662
上海银桥装饰材料有限公司,17199
易尔拓工具(上海)有限公司,29843
锐奇控股股份有限公司,1396
浙江金大门业有限公司,2133
上海赛拓五金工具有限公司,17674
上海吉盛伟邦绿地国际家具村市场经营管理有限公司,28912
深圳金粤幕墙装饰工程有限公司,18699
巴斯夫(中国)有限公司,7334
山东乐得仕软木科技有限公司,16820
上海三达利装饰工程有限公司,17200
维卡塑料(上海)有限公司,1781
英格索兰(中国)投资有限公司,52499
广东必图新材料科技股份有限公司,16757
湖北鄂信钻石科技股份有限公司,17407
中山市安益科技有限公司,2936
大亚人造板集团有限公司,12008
浙江荣鹏气动工具有限公司,19224
深圳雷曼光电科技股份有限公司,6662
凯尼派克工具(上海)有限公司,29841
福建省祥鑫五金科技有限公司,23032
爱科美(北京)材料技术有限公司,47402
肯纳金属(中国)有限公司,842
星牌优时吉建筑材料有限公司,24787
上海恒昊玻璃技术有限公司,18050
启东维度化工科技有限公司,63589
攀华集团有限公司,29753
福建省东升石业股份有限公司,1295
浙江金雅居门业有限公司,2098
山东山水水泥集团有限公司,11515
广州能高共建建材有限公司,13775
福建省漳平木村林产有限公司,15490
浙江中坚科技股份有限公司,8545
天津市金锚集团有限责任公司,8075
河南嘉利美环保材料有限公司,20656
深圳市捷顺科技实业股份有限公司,11424
奥的斯电梯(中国)投资有限公司,1645
爱康企业集团(上海)有限公司,1359
浙江节节高炭业有限公司,7227
深圳市赋安安全系统有限公司,7414
连云港连利水表有限公司,7268
得高健康家居有限公司,609
张家港浦项不锈钢有限公司,11632
广州市梵帝尼家具有限公司,1038
绍兴市奥帅电器股份有限公司,38370
力易得格林利工具(上海)有限公司,19231
哥俩好新材料股份有限公司,7556
福建泉州南星大理石有限公司,1297
安邦电气股份有限公司,24751
司米厨柜有限公司,36904
江苏华东机房集团有限公司,536
浙江贝利工具有限公司,15392
江西华昌竹业集团有限公司,774
慧锐通智能科技股份有限公司,11416
郑州华晶金刚石股份有限公司,17400
亚萨合莱保德安保安制品有限公司,14271
厦门狄耐克电子科技有限公司,13638
宁波望通锁业有限公司,22770
德特威勒(苏州)电缆系统有限公司,35619
上海电气集团股份有限公司,7838
集美控股集团有限公司,7499
中国消防企业集团有限公司,13843
凯拔门控设备(上海)有限公司,24740
利必佳贸易(深圳)有限公司,26923
吉多瑞工具贸易(上海)有限公司,20189
菲时特集团股份有限公司,1370
乐山吉象人造林制品有限公司,694
瑞可达自动门(上海)有限公司,46244
江苏天工工具有限公司,6597
广东中旗新材料科技有限公司,16753
营口盼盼环保硅藻材料有限公司,26862
福建比美特环保集团有限公司,20352
云南锡业股份有限公司,7928
佛山市盛画世纪建材有限公司,26819
康力电梯股份有限公司,1658
广东昊晟陶瓷有限公司,21142
江苏东成电动工具有限公司,1380
大连高科阻燃橡胶有限公司,14259
汉诺贝格(北京)家居建材有限公司,616
广州一江化工有限公司,13584
上海如晶新材料科技有限公司,23260
浙江华彩新材料有限公司,29044
深圳市建辰实业有限公司,582
成都成量工具集团有限公司,9708
佛山市卓品卫浴有限公司,7211
中山市开元灯饰有限公司,1556
山东贺友集团有限公司,12002
广西三威林产工业有限公司,12000
常州佳辰地板集团有限公司,17109
厦门立林科技有限公司,5443
河南省宝泰实业有限公司,665
无锡市胜达塑管熔接设备有限公司,24073
湖南元拓实业集团有限公司,46432
本钢集团有限公司,1848
威胜集团有限公司,3309
上海优合环境工程设计有限公司,37491
福建吴航不锈钢制品有限公司,14633
烟台盟禾板材有限公司,17117
广东泛达电子科技有限公司,11435
佛山市南海帝皇轩卫浴有限公司,14043
中国南玻集团股份有限公司,1900
海湾安全技术有限公司,7408
广东威华股份有限公司,11999
凯特克集团凯特克贸易(上海)有限公司,20190
海虹老人涂料(广州)有限公司,1199
库尔特机电设备(上海)有限公司,18598
万峰石材科技股份有限公司,29647
北京三力威木业有限公司,1688
江苏精湛光电仪器股份有限公司,23981
唐山艾尔斯卫浴有限公司,11985
深圳市华旭科技开发有限公司,24870
嘉兴市奇力电器有限公司,1179
新会江龙翡翠制品有限公司,17189
深圳市科陆电子科技股份有限公司,7320
佛山市蝶依斓家居用品有限公司,1113
上海雷都捷特扶梯销售有限公司,14195
北京中欧普瑞科技有限公司,39961
广东坤煌实业有限公司,47403
广州市白云化工实业有限公司,16487
常州市辰星活动地板有限公司,22613
上海韩华综化贸易有限公司,661
江苏好太太化工有限公司,29420
四川龙蟒集团有限责任公司,13868
首钢总公司,1839
广州市广京装饰材料有限公司,18235
北京瑞嘉欧亚木业有限公司,689
广东黑龙智能科技有限公司,53223
天瑞集团水泥有限公司,4592
肇庆亚洲铝厂有限公司,10852
中国东方电气集团有限公司,7837
富通集团有限公司,3275
沈阳沈飞民品工业有限公司,535
日本太洋电机产业株式会社深圳代表处,18595
苏州帝航防护设施有限公司,17033
北京嘉寓门窗幕墙股份有限公司,21985
格林美股份有限公司,18646
广州市伟正木制品有限公司,648
福建弘景木塑科技股份有限公司,18647
长飞光纤光缆股份有限公司,11844
旭博贸易(上海)有限公司,57995
海南星光活性炭有限公司,35667
常州快克锡焊股份有限公司,18600
山东科虹线缆科技股份有限公司,9184
广东宏陶陶瓷有限公司,14050
广东安居宝数码科技股份有限公司,1430
安徽国风木塑科技有限公司,18641
安徽古德纳克科技股份有限公司,24022
东来涂料技术(上海)有限公司,14147
中涂化工(上海)有限公司,12473
福尔波地板(上海)有限公司,578
牧田(中国)有限公司,1375
环球石材(东莞)股份有限公司,651
夏特装饰材料(上海)有限公司,16619
洁福地板(中国)有限公司,553
太原钢铁(集团)有限公司,1846
杰森石膏板(嘉兴)有限公司,13311
方大新材料(江西)有限公司,18192
关西涂料(中国)投资有限公司,7536
立邦涂料(中国)有限公司,1161
马钢(集团)控股有限公司,1849
汉堡阁电热系统(上海)有限公司,14457
开利空调销售服务(上海)有限公司,181
